### DISCUSSION TITLE
SMTP Error due to SSL

### DISCUSSION THREAD

**Discussion by dl-lim** [dani-garcia/vaultwarden#2040] [Q&A]
### Deployment environment

* docker image vaultwarden/server:1.21.0-alpine

* Reverse proxy and version: docker image jc21/nginx-proxy-manager:2.9.7

Reverse proxy works and SSL is up-to-date. This feature used to work well under the same conditions.

### Steps to reproduce
Didn't have this issue previously on this version, even. But recently, when I did the following, it did not succeed.

I added a new user to the organisation, and `Smtp error` message showed in red. Logs shown above.

No emails were sent, and no emails were received. User was not able to be confirmed in vaultwarden

### Expected behaviour
Email should be sent and received.

### Troubleshooting data
```
[2021-10-14 10:56:29.636][request][INFO] POST /api/organizations/35666776-afda-4a1b-9bf9-8912a6333b55/users/1312eca0-1eb6-4631-b26c-c246a111a8c0/reinvite
[2021-10-14 10:56:30.119][error][ERROR] SmtpError.
[CAUSE] lettre::transport::smtp::Error {
    kind: Connection,
    source: Failure(
        Ssl(
            Error {
                code: ErrorCode(
                    1,
                ),
                cause: Some(
                    Ssl(
                        ErrorStack(
                            [
                                Error {
                                    code: 336134278,
                                    library: "SSL routines",
                                    function: "ssl3_get_server_certificate",
                                    reason: "certificate verify failed",
                                    file: "s3_clnt.c",
                                    line: 1269,
                                },
                            ],
                        ),
                    ),
                ),
            },
            X509VerifyResult {
                code: 10,
                error: "certificate has expired",
            },
        ),
    ),
}
[2021-10-14 10:56:30.119][response][INFO] POST /api/organizations/<org_id>/users/<user_org>/reinvite (reinvite_user) => 400 Bad Request
```

**Comment by BlackDex** [comment]
The mail server you are using is using an invalid certificate. Looking at the message it is expired.

**Comment by BlackDex** [comment]
Ah, wait, you are using an older alpine image i see.
It could be that this has something to do with the Lets Encrypt Certificate DST Root which is expired.
This will probably be fixed if you are going to use the `testing` image instead of the `latest`.

The `testing` image is using the latest OpenSSL version which ignores that certificate and looks at the next one.

**Reply by ninjamonkey198206** [reply]
I just tried the testing image and it does not solve the problem.

**Reply by ninjamonkey198206** [reply]
To be clear, I used the testing image, not the testing-alpine image.

**Reply by BlackDex** [reply]
Well then the certificate is expired i think.
You could verify it via https://www.sslshopper.com/ssl-checker.html
Which supports port numbers

**Reply by BlackDex** [reply]
The testing Alpine is using the very latest OpenSSL available. The Debian based are using the versions provide by Debian.

**Comment by ninjamonkey198206** [comment]
@alderson59 are you using Google Workspace or whatever the hell Google is calling their business G Suite these days?

I tested this via my private server and my business server, same settings aside from user/password that would obviously need to be different.

My private server sends fine. The business server using the Gmail business services fails.

All settings correct in both instances.

**Reply by ninjamonkey198206** [reply]
I've tested Latest, Testing, and Testing-Alpine. All fail when attempting to use Google Workspace either via smtp.gmail.com or smtp-relay.gmail.com (properly configured at both ends), with or without forced TLS, using less secure apps setting or app passwords. I even tried setting the relay to allow from any source, not just from sources in the domain.

Private gmail account works fine.

**Reply by dl-lim** [reply]
Apologies for the late reply, been busy as hell. I'm selfhosting mailcow, actually. SSL/TLS works fine on emails being sent and received. None of that Google "less secure apps" nonsense.

**Comment by ninjamonkey198206** [comment]
Just tested the same settings configuration in another hosted service we run on the same VM, using the Workspaces smtp-relay and direct login, and the emails went through just fine, so the issue is definitely on the Vaultwarden end.

**Reply by BlackDex** [reply]
So, you tested it with smtp.gmail.com and smtp-relay.gmail.com.
And you have also checked these exact settings?
https://github.com/dani-garcia/vaultwarden/wiki/SMTP-Configuration#googlegmail ?

**Reply by ninjamonkey198206** [reply]
Yes. For giggles I tried every variation that I could think of, including that one. Just tried it again for giggles. No joy.

Google's documentation says to use port 587 when TLS is enforced using the smtp-relay. Either 465 or 587 when TLS is not enforced.

For the SMTP server direct login option, 465 for SSL and 587 for TLS.

**Reply by ninjamonkey198206** [reply]
Again, the issue seems to be specific to Google Workspaces addresses. The private email account I tested worked fine using all the images mentioned previously, and the Workspaces account worked using the same settings in another app.

**Reply by BlackDex** [reply]
But, if it returns that the certificate is expired on the exact same smtp host for the workspace account, but not for the personal one, on port 465, that is kinda impossible. Since the certificate is checked before any account checking is done. I can't test it right now my self, but that is strictly not able to happen.

**Reply by ninjamonkey198206** [reply]
I've learned to not say that something can't happen, only that it shouldn't.

**Reply by ninjamonkey198206** [reply]
The issue is on the side of the vaultwarden image.

Personal email account works fine. Workspaces account fails with different errors depending on what config you try. Both private and Workspaces work in a different application on the same domain and hosted VM.

Can't tell you why, it's weird and doesn't make sense given the info I have and my understanding of how it is supposed to work.

But here we are.

**Reply by BlackDex** [reply]
I would suggest to enable SMTP_DEBUG=true and try again.
That works give a bit more details, unless it really is an expired cert, then it won't reach that part at all

**Comment by BlackDex** [comment]
Well, i don't know what is wrong with the attempts you do, but for me it works without any issue. I have tried both private and google workspace accounts with an less-secure-app-password and there are no issues. All tests went fine.

The only thing left for you to test, since it is reporting an expired certificate is to test the connection it self from within the container.
So, you need to login into the container, `docker exec -it vaultwarden sh` after that you can run `openssl s_client -showcerts -connect smtp.gmail.com:465` scroll back to the top where you typed the command, and then check if you see something like this.
```
/ # openssl s_client -showcerts -connect smtp.gmail.com:465
CONNECTED(00000003)
depth=2 C = US, O = Google Trust Services LLC, CN = GTS Root R1
verify return:1
depth=1 C = US, O = Google Trust Services LLC, CN = GTS CA 1C3
verify return:1
depth=0 CN = smtp.gmail.com
verify return:1
---
Certificate chain
```

All chains should return `verify return:1`, if not, then there is something wrong. And maybe there is something in between your server and the server from google?

The thing is, an expired certificate just can't happen if the cert really isn't expired.
Also, check the date/time on the host/server/container.

Also, check the `/admin/diagnostics` page, which will show some generic checks if they are ok or not.

**Reply by ninjamonkey198206** [reply]
Well that's odd. The certs check out via that command, both direct and relay.

What's really odd is that this is the only app running on that server that has an issue, and I've got the relay and other email configs set up the same for all of those subdomains. Firewall shouldn't be an issue either, since the other apps send emails just fine.

Turned on the debugging, but I can't tell where it's going wrong.

**Reply by ninjamonkey198206** [reply]
Tried both direct and relay, same type of error. Diagnostics page shows all ok.

[2021-10-16 09:53:50.399][request][INFO] POST /admin/test/smtp/

[2021-10-16 09:53:50.670][lettre::transport::smtp::client::connection][DEBUG] << 220 smtp-relay.gmail.com ESMTP ob13sm865008pjb.4 - gsmtp<CRLF> 

[2021-10-16 09:53:50.670][lettre::transport::smtp::client::connection][DEBUG] Wrote: EHLO bitwarden<CRLF> 

[2021-10-16 09:53:50.711][lettre::transport::smtp::client::connection][DEBUG] << 250-smtp-relay.gmail.com at your service, [34.68.199.125]<CRLF> 

[2021-10-16 09:53:50.711][lettre::transport::smtp::client::connection][DEBUG] << 250-smtp-relay.gmail.com at your service, [34.68.199.125]<CRLF>250-SIZE 157286400<CRLF> 

[2021-10-16 09:53:50.711][lettre::transport::smtp::client::connection][DEBUG] << 250-smtp-relay.gmail.com at your service, [34.68.199.125]<CRLF>250-SIZE 157286400<CRLF>250-8BITMIME<CRLF> 

[2021-10-16 09:53:50.711][lettre::transport::smtp::client::connection][DEBUG] << 250-smtp-relay.gmail.com at your service, [34.68.199.125]<CRLF>250-SIZE 157286400<CRLF>250-8BITMIME<CRLF>250-AUTH LOGIN PLAIN XOAUTH2 PLAIN-CLIENTTOKEN OAUTHBEARER XOAUTH<CRLF> 

[2021-10-16 09:53:50.711][lettre::transport::smtp::client::connection][DEBUG] << 250-smtp-relay.gmail.com at your service, [34.68.199.125]<CRLF>250-SIZE 157286400<CRLF>250-8BITMIME<CRLF>250-AUTH LOGIN PLAIN XOAUTH2 PLAIN-CLIENTTOKEN OAUTHBEARER XOAUTH<CRLF>250-ENHANCEDSTATUSCODES<CRLF> 

[2021-10-16 09:53:50.711][lettre::transport::smtp::client::connection][DEBUG] << 250-smtp-relay.gmail.com at your service, [34.68.199.125]<CRLF>250-SIZE 157286400<CRLF>250-8BITMIME<CRLF>250-AUTH LOGIN PLAIN XOAUTH2 PLAIN-CLIENTTOKEN OAUTHBEARER XOAUTH<CRLF>250-ENHANCEDSTATUSCODES<CRLF>250-PIPELINING<CRLF> 

[2021-10-16 09:53:50.711][lettre::transport::smtp::client::connection][DEBUG] << 250-smtp-relay.gmail.com at your service, [34.68.199.125]<CRLF>250-SIZE 157286400<CRLF>250-8BITMIME<CRLF>250-AUTH LOGIN PLAIN XOAUTH2 PLAIN-CLIENTTOKEN OAUTHBEARER XOAUTH<CRLF>250-ENHANCEDSTATUSCODES<CRLF>250-PIPELINING<CRLF>250-CHUNKING<CRLF> 

[2021-10-16 09:53:50.711][lettre::transport::smtp::client::connection][DEBUG] << 250-smtp-relay.gmail.com at your service, [34.68.199.125]<CRLF>250-SIZE 157286400<CRLF>250-8BITMIME<CRLF>250-AUTH LOGIN PLAIN XOAUTH2 PLAIN-CLIENTTOKEN OAUTHBEARER XOAUTH<CRLF>250-ENHANCEDSTATUSCODES<CRLF>250-PIPELINING<CRLF>250-CHUNKING<CRLF>250 SMTPUTF8<CRLF> 

[2021-10-16 09:53:50.711][lettre::transport::smtp::client::connection][DEBUG] server smtp-relay.gmail.com with {SmtpUtfEight, Authentication(Xoauth2), EightBitMime, Authentication(Plain), Authentication(Login)} 

[2021-10-16 09:53:50.711][lettre::transport::smtp::client::connection][DEBUG] Wrote: AUTH PLAIN gibberish==<CRLF> 

[2021-10-16 09:53:50.988][lettre::transport::smtp::client::connection][DEBUG] << 235 2.7.0 Accepted<CRLF> 

[2021-10-16 09:53:50.988][lettre::transport::smtp::client::connection][DEBUG] Wrote: MAIL FROM:<mail@emaple.com><CRLF> 

[2021-10-16 09:53:51.031][lettre::transport::smtp::client::connection][DEBUG] << 250 2.1.0 OK ob13sm865008pjb.4 - gsmtp<CRLF> 

[2021-10-16 09:53:51.031][lettre::transport::smtp::client::connection][DEBUG] Wrote: RCPT TO:<me@example.com><CRLF> 

[2021-10-16 09:53:51.070][lettre::transport::smtp::client::connection][DEBUG] << 250 2.1.5 OK ob13sm865008pjb.4 - gsmtp<CRLF> 

[2021-10-16 09:53:51.070][lettre::transport::smtp::client::connection][DEBUG] Wrote: DATA<CRLF> 

[2021-10-16 09:53:51.313][lettre::transport::smtp::client::connection][DEBUG] << 354  Go ahead ob13sm865008pjb.4 - gsmtp<CRLF> 

[2021-10-16 09:53:51.314][lettre::transport::smtp::client::connection][DEBUG] Wrote: Message-ID: <ca61f523-00f1-4112-9922-cd9bff141e69@example.com><CRLF>To: me@example.com<CRLF>From: Bitwarden <mail@example.com><CRLF>Subject: Vaultwarden SMTP Test<CRLF>MIME-Version: 1.0<CRLF>Date: Sat, 16 Oct 2021 14:53:50 -0000<CRLF>Content-Type: multipart/alternative; <CRLF> boundary="lh9qN3fwjRkr8ahy08JeEB3paVTFH3owJ3zjuVVU"<CRLF><CRLF>--lh9qN3fwjRkr8ahy08JeEB3paVTFH3owJ3zjuVVU<CRLF>Content-Transfer-Encoding: base64<CRLF>Content-Type: text/plain; charset=utf-8<CRLF><CRLF>VGhpcyBpcyBhIHRlc3QgZW1haWwgdG8gdmVyaWZ5IHRoZSBTTVRQIGNvbmZpZ3VyYXRpb24gZm9y<CRLF>IGh0dHBzOi8vYml0d2FyZGVuLnJlbnRhbmVyZGNvbnN1bHRpbmcuY29tLg0KDQpXaGVuIHlvdSBj<CRLF>YW4gcmVhZCB0aGlzIGVtYWlsIGl0IGlzIHByb2JhYmx5IGNvbmZpZ3VyZWQgY29ycmVjdGx5Lg0K<CRLF>DQo9PT0NCkdpdGh1YjogaHR0cHM6Ly9naXRodWIuY29tL2RhbmktZ2FyY2lhL3ZhdWx0d2FyZGVu<CRLF><CRLF>--lh9qN3fwjRkr8ahy08JeEB3paVTFH3owJ3zjuVVU<CRLF>Content-Transfer-Encoding: base64<CRLF>Content-Type: text/html; charset=utf-8<CRLF> Gibberish

[2021-10-16 09:53:51.314][lettre::transport::smtp::client::connection][DEBUG] Wrote: <CRLF>.<CRLF> 

[2021-10-16 09:54:06.334][lettre::transport::smtp::client::connection][DEBUG] Wrote: QUIT<CRLF> 

[2021-10-16 09:54:21.439][error][ERROR] Smtp.

[CAUSE] lettre::transport::smtp::Error {

    kind: Network,

    source: Os {

        code: 11,

        kind: WouldBlock,

        message: "Resource temporarily unavailable",

    },

}

[2021-10-16 09:54:21.439][response][INFO] POST /admin/test/smtp (test_smtp) => 400 Bad Request

**Reply by ninjamonkey198206** [reply]
That's using the config listed on the page you posted, with app password.

**Reply by BlackDex** [reply]
Strange, it does look it accepts the cert. And it even sends out an mail which google seems to except. But after/during the quit it seems to loose it's connection which results in an error. Is the mail also not delivered? Since it did send the `.` which means end of mail.

**Reply by ninjamonkey198206** [reply]
The mail never gets delivered and doesn't show up anywhere I can find in the Google admin or the account.

The one thing I don't have access to for some reason is the quarantine section of the admin page.

**Reply by ninjamonkey198206** [reply]
I'm gonna need to install some padding on the walls so I don't crack my skull from beating my head against them.

**Comment by ninjamonkey198206** [comment]
@BlackDex For troubleshooting:

Our VM that I'm using is hosted by Google, all traffic allowed out and standard http, https, and their other standard ports open (essentially Googles default firewall config for their hosted VMs, aside from one additional port for another service).

Container mapped ports are exposed on localhost only (mapped 127.0.1.1:3012:3012, for example).
All other containers work flawlessly.

IPTables firewall on the VM, no management app. I've omitted unrelated rules:
```text
# Generated by iptables-save v1.8.4
*filter
:INPUT DROP [45:12527]
:FORWARD DROP [0:0]
:OUTPUT DROP [63:6851]

# Allow outbound SMTP
-A OUTPUT -o ens4 -p tcp --dport 25 -m conntrack --ctstate NEW,ESTABLISHED -j ACCEPT
-A INPUT -i ens4 -p tcp --sport 25 -m conntrack --ctstate ESTABLISHED -j ACCEPT

# Allow outbound SMTP SSL/TLS
-A OUTPUT -o ens4 -p tcp -m multiport --dports 465,587 -m conntrack --ctstate NEW,ESTABLISHED -j ACCEPT
-A INPUT -i ens4 -p tcp -m multiport --sports 465,587 -m conntrack --ctstate ESTABLISHED -j ACCEPT

# Allow outbound HTTP and HTTPS
-A OUTPUT -o ens4 -p tcp -m multiport --dports 80,443 -m conntrack --ctstate NEW,ESTABLISHED -j ACCEPT
-A INPUT -i ens4 -p tcp -m multiport --sports 80,443 -m conntrack --ctstate ESTABLISHED -j ACCEPT

# Allow incoming HTTP and HTTPS
-A INPUT -i ens4 -p tcp -m multiport --dports 80,443 -m conntrack --ctstate NEW,ESTABLISHED -j ACCEPT
-A OUTPUT -o ens4 -p tcp -m multiport --sports 80,443 -m conntrack --ctstate ESTABLISHED -j ACCEPT

# Allow Vaultwarden proxy access (necessary if using full drop by default to enable ingress to containers via localhost, use container internal ports)
-A INPUT -i br-81888841de4b -p tcp -m multiport --sports 80,3012 -m conntrack --ctstate NEW,ESTABLISHED -j ACCEPT
-A OUTPUT -o br-81888841de4b -p tcp -m multiport --dports 80,3012 -m conntrack --ctstate NEW,ESTABLISHED -j ACCEPT

# Allow loopback
-A INPUT -i lo -j ACCEPT
-A OUTPUT -o lo -j ACCEPT

# Allow established and related traffic
-A INPUT -i ens4 -m conntrack --ctstate ESTABLISHED,RELATED -j ACCEPT
-A OUTPUT -o ens4 -m conntrack --ctstate ESTABLISHED,RELATED -j ACCEPT

# Enable logging
-A INPUT -j LOG

# Drop invalid packets
-A INPUT -m conntrack --ctstate INVALID -j DROP

COMMIT
# Completed
```
HAProxy is installed and provides HTTPS redirect, SSL offloading, and reverse proxy services. Listening on 80 and 443, routing to 127.0.1.1 on appropriate ports.

**Comment by BlackDex** [comment]
I'm not sure why you have separate rules for output of 465,587 and 25 while you say all outgoing is allowed by default. I think you can remove those rules and try to see what happens.
I have added these to my firewall, and it didn't have any effect, but who knows what it does in your environment.

**Reply by ninjamonkey198206** [reply]
Google's firewall allows all out by default.

The iptables firewall in the VM is drop all by default. I use the same basic iptables firewall config on all of my servers, whether VM or baremetal.

I've actually got a 400,000+ line script that I'm working on updating to be OS version agnostic that takes a base Ubuntu Server install and configures everything with minimal interaction, including security configs, firewall, and options for installing Plex, Docker, HAProxy, ownCloud, Virtualbox, and a slew of other apps/services in the works.

**Reply by ninjamonkey198206** [reply]
Imagine Google's part is like a physical router/firewall with ports forwarded to the server (the hosted VM).

The server VM has its own firewall configured, just as a baremetal machine would behind a router.

**Reply by ninjamonkey198206** [reply]
I'm beginning to think the issue has something to do with it being a VM hosted by Google, as this doesn't happen on my home server.

**Reply by ninjamonkey198206** [reply]
Just tested the SMTP relay using the same Google Workspaces email address for login on my home server, which has the exact same firewall settings in place on the server. Worked flawlessly.

So the issue is definitely the fact that the VM this is referring to is hosted on Google's service.

Now to determine why. I can't be the only one hosting a VM through them, so figuring out what the issue is would be helpful.

**Reply by ninjamonkey198206** [reply]
My home server runs behind a PFSense firewall, with the same basic config as the Google firewall rules, so this should be interesting. Going to start playing with the Google firewall ports to see if it'll help.

**Reply by ninjamonkey198206** [reply]
@BlackDex just to verify, lettre or whatever the container uses to send email try doesn't try to use port 25 at any point, even when set up to use 465, correct?

Google blocks port 25 to and from any ip address outside the "local" network of the VM, period, including to their smtp and smtp relay services. Any communications on that port are blocked, and cannot be overridden from what I can tell.

**Reply by ninjamonkey198206** [reply]
@BlackDex Looks like the lettre folks know about some issues similar to this.

https://github.com/lettre/lettre/issues/634

**Reply by BlackDex** [reply]
I do not think that is the same. Because i this case it seems it does connect, and it does send everything, upon or until the final `.` is send.
Then the connection either fails or what ever.

Maybe the only way to see what is happening here is checking some tcpdump/wireshark stuff and compare it to a working environment.
See if there is anything strange going on there.

That issue you are linking to is more something like how to configure it actually for either users or the library users.

**Reply by ninjamonkey198206** [reply]
This isn't my wheelhouse, but here's a tcpdump started just before sending a test email, and stopped after the error is displayed on screen, filtered by the ip address of the docker container.  Also, thank you very much for helping with this. 
```text
As destination

15:31:24.044570 IP 172.18.0.1.59036 > 172.18.0.2.80: Flags [S], seq 3148775056, win 64240, options [mss 1460,sackOK,TS val 1193974019 ecr 0,nop,wscale 7], length 0
15:31:24.044578 IP 172.18.0.1.59036 > 172.18.0.2.80: Flags [S], seq 3148775056, win 64240, options [mss 1460,sackOK,TS val 1193974019 ecr 0,nop,wscale 7], length 0
15:31:24.044624 IP 172.18.0.1.59036 > 172.18.0.2.80: Flags [.], ack 510931550, win 502, options [nop,nop,TS val 1193974019 ecr 3230459918], length 0
15:31:24.044625 IP 172.18.0.1.59036 > 172.18.0.2.80: Flags [.], ack 1, win 502, options [nop,nop,TS val 1193974019 ecr 3230459918], length 0
15:31:24.044792 IP 172.18.0.1.59036 > 172.18.0.2.80: Flags [P.], seq 0:1341, ack 1, win 502, options [nop,nop,TS val 1193974019 ecr 3230459918], length 1341: HTTP: POST /admin/test/smtp/ HTTP/1.1
15:31:24.044795 IP 172.18.0.1.59036 > 172.18.0.2.80: Flags [P.], seq 0:1341, ack 1, win 502, options [nop,nop,TS val 1193974019 ecr 3230459918], length 1341: HTTP: POST /admin/test/smtp/ HTTP/1.1
15:31:24.056512 IP 142.250.148.28.465 > 172.18.0.2.48274: Flags [S.], seq 3649093871, ack 2089657447, win 65535, options [mss 1430,sackOK,TS val 212963776 ecr 2220283587,nop,wscale 8], length 0
15:31:24.056518 IP 142.250.148.28.465 > 172.18.0.2.48274: Flags [S.], seq 3649093871, ack 2089657447, win 65535, options [mss 1430,sackOK,TS val 212963776 ecr 2220283587,nop,wscale 8], length 0
15:31:24.057256 IP 142.250.148.28.465 > 172.18.0.2.48274: Flags [.], ack 518, win 261, options [nop,nop,TS val 212963777 ecr 2220283588], length 0
15:31:24.057260 IP 142.250.148.28.465 > 172.18.0.2.48274: Flags [.], ack 518, win 261, options [nop,nop,TS val 212963777 ecr 2220283588], length 0
15:31:24.057714 IP 142.250.148.28.465 > 172.18.0.2.48274: Flags [.], seq 1:1419, ack 518, win 261, options [nop,nop,TS val 212963778 ecr 2220283588], length 1418
15:31:24.057717 IP 142.250.148.28.465 > 172.18.0.2.48274: Flags [.], seq 1:1419, ack 518, win 261, options [nop,nop,TS val 212963778 ecr 2220283588], length 1418
15:31:24.057720 IP 142.250.148.28.465 > 172.18.0.2.48274: Flags [.], seq 1419:2837, ack 518, win 261, options [nop,nop,TS val 212963778 ecr 2220283588], length 1418
15:31:24.057721 IP 142.250.148.28.465 > 172.18.0.2.48274: Flags [.], seq 1419:2837, ack 518, win 261, options [nop,nop,TS val 212963778 ecr 2220283588], length 1418
15:31:24.057723 IP 142.250.148.28.465 > 172.18.0.2.48274: Flags [.], seq 2837:4255, ack 518, win 261, options [nop,nop,TS val 212963778 ecr 2220283588], length 1418
15:31:24.057723 IP 142.250.148.28.465 > 172.18.0.2.48274: Flags [.], seq 2837:4255, ack 518, win 261, options [nop,nop,TS val 212963778 ecr 2220283588], length 1418
15:31:24.057725 IP 142.250.148.28.465 > 172.18.0.2.48274: Flags [P.], seq 4255:4307, ack 518, win 261, options [nop,nop,TS val 212963778 ecr 2220283588], length 52
15:31:24.057726 IP 142.250.148.28.465 > 172.18.0.2.48274: Flags [P.], seq 4255:4307, ack 518, win 261, options [nop,nop,TS val 212963778 ecr 2220283588], length 52
15:31:24.063472 IP 142.250.148.28.465 > 172.18.0.2.48274: Flags [.], ack 598, win 261, options [nop,nop,TS val 212963784 ecr 2220283590], length 0
15:31:24.063479 IP 142.250.148.28.465 > 172.18.0.2.48274: Flags [.], ack 598, win 261, options [nop,nop,TS val 212963784 ecr 2220283590], length 0
15:31:24.110876 IP 142.250.148.28.465 > 172.18.0.2.48274: Flags [P.], seq 4307:4925, ack 598, win 261, options [nop,nop,TS val 212963831 ecr 2220283590], length 618
15:31:24.110884 IP 142.250.148.28.465 > 172.18.0.2.48274: Flags [P.], seq 4307:4925, ack 598, win 261, options [nop,nop,TS val 212963831 ecr 2220283590], length 618
15:31:24.111697 IP 142.250.148.28.465 > 172.18.0.2.48274: Flags [.], ack 639, win 261, options [nop,nop,TS val 212963832 ecr 2220283643], length 0
15:31:24.111700 IP 142.250.148.28.465 > 172.18.0.2.48274: Flags [.], ack 639, win 261, options [nop,nop,TS val 212963832 ecr 2220283643], length 0
15:31:24.122995 IP 142.250.148.28.465 > 172.18.0.2.48274: Flags [P.], seq 4925:5176, ack 639, win 261, options [nop,nop,TS val 212963843 ecr 2220283643], length 251
15:31:24.123003 IP 142.250.148.28.465 > 172.18.0.2.48274: Flags [P.], seq 4925:5176, ack 639, win 261, options [nop,nop,TS val 212963843 ecr 2220283643], length 251
15:31:24.128503 IP 142.250.148.28.465 > 172.18.0.2.48274: Flags [.], ack 738, win 261, options [nop,nop,TS val 212963849 ecr 2220283655], length 0
15:31:24.128511 IP 142.250.148.28.465 > 172.18.0.2.48274: Flags [.], ack 738, win 261, options [nop,nop,TS val 212963849 ecr 2220283655], length 0
15:31:24.321910 IP 142.250.148.28.465 > 172.18.0.2.48274: Flags [P.], seq 5176:5218, ack 738, win 261, options [nop,nop,TS val 212964042 ecr 2220283655], length 42
15:31:24.321918 IP 142.250.148.28.465 > 172.18.0.2.48274: Flags [P.], seq 5176:5218, ack 738, win 261, options [nop,nop,TS val 212964042 ecr 2220283655], length 42
15:31:24.322572 IP 142.250.148.28.465 > 172.18.0.2.48274: Flags [.], ack 802, win 261, options [nop,nop,TS val 212964043 ecr 2220283854], length 0
15:31:24.322576 IP 142.250.148.28.465 > 172.18.0.2.48274: Flags [.], ack 802, win 261, options [nop,nop,TS val 212964043 ecr 2220283854], length 0
15:31:24.337598 IP 142.250.148.28.465 > 172.18.0.2.48274: Flags [P.], seq 5218:5280, ack 802, win 261, options [nop,nop,TS val 212964058 ecr 2220283854], length 62
15:31:24.337606 IP 142.250.148.28.465 > 172.18.0.2.48274: Flags [P.], seq 5218:5280, ack 802, win 261, options [nop,nop,TS val 212964058 ecr 2220283854], length 62
15:31:24.342523 IP 142.250.148.28.465 > 172.18.0.2.48274: Flags [.], ack 857, win 261, options [nop,nop,TS val 212964063 ecr 2220283869], length 0
15:31:24.342530 IP 142.250.148.28.465 > 172.18.0.2.48274: Flags [.], ack 857, win 261, options [nop,nop,TS val 212964063 ecr 2220283869], length 0
15:31:24.347309 IP 142.250.148.28.465 > 172.18.0.2.48274: Flags [P.], seq 5280:5342, ack 857, win 261, options [nop,nop,TS val 212964067 ecr 2220283869], length 62
15:31:24.347316 IP 142.250.148.28.465 > 172.18.0.2.48274: Flags [P.], seq 5280:5342, ack 857, win 261, options [nop,nop,TS val 212964067 ecr 2220283869], length 62
15:31:24.352509 IP 142.250.148.28.465 > 172.18.0.2.48274: Flags [.], ack 885, win 261, options [nop,nop,TS val 212964073 ecr 2220283879], length 0
15:31:24.352516 IP 142.250.148.28.465 > 172.18.0.2.48274: Flags [.], ack 885, win 261, options [nop,nop,TS val 212964073 ecr 2220283879], length 0
15:31:24.571957 IP 142.250.148.28.465 > 172.18.0.2.48274: Flags [P.], seq 5342:5405, ack 885, win 261, options [nop,nop,TS val 212964292 ecr 2220283879], length 63
15:31:24.571965 IP 142.250.148.28.465 > 172.18.0.2.48274: Flags [P.], seq 5342:5405, ack 885, win 261, options [nop,nop,TS val 212964292 ecr 2220283879], length 63
15:31:24.777940 IP 142.250.148.28.465 > 172.18.0.2.48274: Flags [P.], seq 5342:5405, ack 885, win 261, options [nop,nop,TS val 212964498 ecr 2220283879], length 63
15:31:24.777947 IP 142.250.148.28.465 > 172.18.0.2.48274: Flags [P.], seq 5342:5405, ack 885, win 261, options [nop,nop,TS val 212964498 ecr 2220283879], length 63
15:31:29.256818 ARP, Request who-has 172.18.0.2 tell 172.18.0.1, length 28
15:31:29.256847 ARP, Request who-has 172.18.0.2 tell 172.18.0.1, length 28
15:31:54.066201 IP 172.18.0.1.59036 > 172.18.0.2.80: Flags [F.], seq 1341, ack 1, win 502, options [nop,nop,TS val 1194004041 ecr 3230459918], length 0
15:31:54.066206 IP 172.18.0.1.59036 > 172.18.0.2.80: Flags [F.], seq 1341, ack 1, win 502, options [nop,nop,TS val 1194004041 ecr 3230459918], length 0
15:31:54.858205 IP 142.250.148.28.465 > 172.18.0.2.48274: Flags [.], ack 885, win 266, options [nop,nop,TS val 212994578 ecr 2220283879,nop,nop,sack 1 {16483:17166}], length 0
15:31:54.858211 IP 142.250.148.28.465 > 172.18.0.2.48274: Flags [.], ack 885, win 266, options [nop,nop,TS val 212994578 ecr 2220283879,nop,nop,sack 1 {16483:17166}], length 0
15:31:54.858337 IP 172.18.0.1.59036 > 172.18.0.2.80: Flags [.], ack 1094, win 501, options [nop,nop,TS val 1194004833 ecr 3230490732], length 0
15:31:54.858338 IP 172.18.0.1.59036 > 172.18.0.2.80: Flags [.], ack 1094, win 501, options [nop,nop,TS val 1194004833 ecr 3230490732], length 0
15:31:54.858366 IP 172.18.0.1.59036 > 172.18.0.2.80: Flags [.], ack 1095, win 501, options [nop,nop,TS val 1194004833 ecr 3230490732], length 0
15:31:54.858366 IP 172.18.0.1.59036 > 172.18.0.2.80: Flags [.], ack 1095, win 501, options [nop,nop,TS val 1194004833 ecr 3230490732], length 0


As source

15:31:24.044605 IP 172.18.0.2.80 > 172.18.0.1.59036: Flags [S.], seq 510931549, ack 3148775057, win 65160, options [mss 1460,sackOK,TS val 3230459918 ecr 1193974019,nop,wscale 7], length 0
15:31:24.044611 IP 172.18.0.2.80 > 172.18.0.1.59036: Flags [S.], seq 510931549, ack 3148775057, win 65160, options [mss 1460,sackOK,TS val 3230459918 ecr 1193974019,nop,wscale 7], length 0
15:31:24.044812 IP 172.18.0.2.80 > 172.18.0.1.59036: Flags [.], ack 1342, win 501, options [nop,nop,TS val 3230459918 ecr 1193974019], length 0
15:31:24.044815 IP 172.18.0.2.80 > 172.18.0.1.59036: Flags [.], ack 1342, win 501, options [nop,nop,TS val 3230459918 ecr 1193974019], length 0
15:31:24.055129 IP 172.18.0.2.48274 > 142.250.148.28.465: Flags [S], seq 2089657446, win 64240, options [mss 1460,sackOK,TS val 2220283587 ecr 0,nop,wscale 7], length 0
15:31:24.055144 IP 172.18.0.2.48274 > 142.250.148.28.465: Flags [S], seq 2089657446, win 64240, options [mss 1460,sackOK,TS val 2220283587 ecr 0,nop,wscale 7], length 0
15:31:24.056556 IP 172.18.0.2.48274 > 142.250.148.28.465: Flags [.], ack 3649093872, win 502, options [nop,nop,TS val 2220283588 ecr 212963776], length 0
15:31:24.056561 IP 172.18.0.2.48274 > 142.250.148.28.465: Flags [.], ack 1, win 502, options [nop,nop,TS val 2220283588 ecr 212963776], length 0
15:31:24.056925 IP 172.18.0.2.48274 > 142.250.148.28.465: Flags [P.], seq 0:517, ack 1, win 502, options [nop,nop,TS val 2220283588 ecr 212963776], length 517
15:31:24.056929 IP 172.18.0.2.48274 > 142.250.148.28.465: Flags [P.], seq 0:517, ack 1, win 502, options [nop,nop,TS val 2220283588 ecr 212963776], length 517
15:31:24.057751 IP 172.18.0.2.48274 > 142.250.148.28.465: Flags [.], ack 1419, win 501, options [nop,nop,TS val 2220283589 ecr 212963778], length 0
15:31:24.057754 IP 172.18.0.2.48274 > 142.250.148.28.465: Flags [.], ack 1419, win 501, options [nop,nop,TS val 2220283589 ecr 212963778], length 0
15:31:24.057760 IP 172.18.0.2.48274 > 142.250.148.28.465: Flags [.], ack 2837, win 497, options [nop,nop,TS val 2220283589 ecr 212963778], length 0
15:31:24.057761 IP 172.18.0.2.48274 > 142.250.148.28.465: Flags [.], ack 2837, win 497, options [nop,nop,TS val 2220283589 ecr 212963778], length 0
15:31:24.057764 IP 172.18.0.2.48274 > 142.250.148.28.465: Flags [.], ack 4255, win 491, options [nop,nop,TS val 2220283589 ecr 212963778], length 0
15:31:24.057765 IP 172.18.0.2.48274 > 142.250.148.28.465: Flags [.], ack 4255, win 491, options [nop,nop,TS val 2220283589 ecr 212963778], length 0
15:31:24.057767 IP 172.18.0.2.48274 > 142.250.148.28.465: Flags [.], ack 4307, win 491, options [nop,nop,TS val 2220283589 ecr 212963778], length 0
15:31:24.057768 IP 172.18.0.2.48274 > 142.250.148.28.465: Flags [.], ack 4307, win 491, options [nop,nop,TS val 2220283589 ecr 212963778], length 0
15:31:24.058708 IP 172.18.0.2.48274 > 142.250.148.28.465: Flags [P.], seq 517:597, ack 4307, win 501, options [nop,nop,TS val 2220283590 ecr 212963778], length 80
15:31:24.058712 IP 172.18.0.2.48274 > 142.250.148.28.465: Flags [P.], seq 517:597, ack 4307, win 501, options [nop,nop,TS val 2220283590 ecr 212963778], length 80
15:31:24.110912 IP 172.18.0.2.48274 > 142.250.148.28.465: Flags [.], ack 4925, win 501, options [nop,nop,TS val 2220283642 ecr 212963831], length 0
15:31:24.110916 IP 172.18.0.2.48274 > 142.250.148.28.465: Flags [.], ack 4925, win 501, options [nop,nop,TS val 2220283642 ecr 212963831], length 0
15:31:24.111281 IP 172.18.0.2.48274 > 142.250.148.28.465: Flags [P.], seq 597:638, ack 4925, win 501, options [nop,nop,TS val 2220283643 ecr 212963831], length 41
15:31:24.111295 IP 172.18.0.2.48274 > 142.250.148.28.465: Flags [P.], seq 597:638, ack 4925, win 501, options [nop,nop,TS val 2220283643 ecr 212963831], length 41
15:31:24.123033 IP 172.18.0.2.48274 > 142.250.148.28.465: Flags [.], ack 5176, win 501, options [nop,nop,TS val 2220283655 ecr 212963843], length 0
15:31:24.123038 IP 172.18.0.2.48274 > 142.250.148.28.465: Flags [.], ack 5176, win 501, options [nop,nop,TS val 2220283655 ecr 212963843], length 0
15:31:24.123272 IP 172.18.0.2.48274 > 142.250.148.28.465: Flags [P.], seq 638:737, ack 5176, win 501, options [nop,nop,TS val 2220283655 ecr 212963843], length 99
15:31:24.123274 IP 172.18.0.2.48274 > 142.250.148.28.465: Flags [P.], seq 638:737, ack 5176, win 501, options [nop,nop,TS val 2220283655 ecr 212963843], length 99
15:31:24.321949 IP 172.18.0.2.48274 > 142.250.148.28.465: Flags [.], ack 5218, win 501, options [nop,nop,TS val 2220283853 ecr 212964042], length 0
15:31:24.321953 IP 172.18.0.2.48274 > 142.250.148.28.465: Flags [.], ack 5218, win 501, options [nop,nop,TS val 2220283853 ecr 212964042], length 0
15:31:24.322175 IP 172.18.0.2.48274 > 142.250.148.28.465: Flags [P.], seq 737:801, ack 5218, win 501, options [nop,nop,TS val 2220283854 ecr 212964042], length 64
15:31:24.322178 IP 172.18.0.2.48274 > 142.250.148.28.465: Flags [P.], seq 737:801, ack 5218, win 501, options [nop,nop,TS val 2220283854 ecr 212964042], length 64
15:31:24.337783 IP 172.18.0.2.48274 > 142.250.148.28.465: Flags [P.], seq 801:856, ack 5280, win 501, options [nop,nop,TS val 2220283869 ecr 212964058], length 55
15:31:24.337787 IP 172.18.0.2.48274 > 142.250.148.28.465: Flags [P.], seq 801:856, ack 5280, win 501, options [nop,nop,TS val 2220283869 ecr 212964058], length 55
15:31:24.347500 IP 172.18.0.2.48274 > 142.250.148.28.465: Flags [P.], seq 856:884, ack 5342, win 501, options [nop,nop,TS val 2220283879 ecr 212964067], length 28
15:31:24.347504 IP 172.18.0.2.48274 > 142.250.148.28.465: Flags [P.], seq 856:884, ack 5342, win 501, options [nop,nop,TS val 2220283879 ecr 212964067], length 28
15:31:24.572205 IP 172.18.0.2.48274 > 142.250.148.28.465: Flags [P.], seq 884:7974, ack 5405, win 501, options [nop,nop,TS val 2220284104 ecr 212964292], length 7090
15:31:24.572211 IP 172.18.0.2.48274 > 142.250.148.28.465: Flags [P.], seq 884:7974, ack 5405, win 501, options [nop,nop,TS val 2220284104 ecr 212964292], length 7090
15:31:24.572236 IP 172.18.0.2.48274 > 142.250.148.28.465: Flags [P.], seq 7974:15064, ack 5405, win 501, options [nop,nop,TS val 2220284104 ecr 212964292], length 7090
15:31:24.572238 IP 172.18.0.2.48274 > 142.250.148.28.465: Flags [P.], seq 7974:15064, ack 5405, win 501, options [nop,nop,TS val 2220284104 ecr 212964292], length 7090
15:31:24.588862 IP 172.18.0.2.48274 > 142.250.148.28.465: Flags [.], seq 15064:16482, ack 5405, win 501, options [nop,nop,TS val 2220284120 ecr 212964292], length 1418
15:31:24.588876 IP 172.18.0.2.48274 > 142.250.148.28.465: Flags [.], seq 15064:16482, ack 5405, win 501, options [nop,nop,TS val 2220284120 ecr 212964292], length 1418
15:31:24.777971 IP 172.18.0.2.48274 > 142.250.148.28.465: Flags [.], ack 5405, win 501, options [nop,nop,TS val 2220284310 ecr 212964498,nop,nop,sack 1 {5342:5405}], length 0
15:31:24.777975 IP 172.18.0.2.48274 > 142.250.148.28.465: Flags [.], ack 5405, win 501, options [nop,nop,TS val 2220284310 ecr 212964498,nop,nop,sack 1 {5342:5405}], length 0
15:31:24.796837 IP 172.18.0.2.48274 > 142.250.148.28.465: Flags [.], seq 884:2302, ack 5405, win 501, options [nop,nop,TS val 2220284328 ecr 212964498], length 1418
15:31:24.796848 IP 172.18.0.2.48274 > 142.250.148.28.465: Flags [.], seq 884:2302, ack 5405, win 501, options [nop,nop,TS val 2220284328 ecr 212964498], length 1418
15:31:25.224829 IP 172.18.0.2.48274 > 142.250.148.28.465: Flags [.], seq 884:2302, ack 5405, win 501, options [nop,nop,TS val 2220284756 ecr 212964498], length 1418
15:31:25.224839 IP 172.18.0.2.48274 > 142.250.148.28.465: Flags [.], seq 884:2302, ack 5405, win 501, options [nop,nop,TS val 2220284756 ecr 212964498], length 1418
15:31:26.056805 IP 172.18.0.2.48274 > 142.250.148.28.465: Flags [.], seq 884:2302, ack 5405, win 501, options [nop,nop,TS val 2220285588 ecr 212964498], length 1418
15:31:26.056814 IP 172.18.0.2.48274 > 142.250.148.28.465: Flags [.], seq 884:2302, ack 5405, win 501, options [nop,nop,TS val 2220285588 ecr 212964498], length 1418
15:31:27.720823 IP 172.18.0.2.48274 > 142.250.148.28.465: Flags [.], seq 884:2302, ack 5405, win 501, options [nop,nop,TS val 2220287252 ecr 212964498], length 1418
15:31:27.720835 IP 172.18.0.2.48274 > 142.250.148.28.465: Flags [.], seq 884:2302, ack 5405, win 501, options [nop,nop,TS val 2220287252 ecr 212964498], length 1418
15:31:29.257021 ARP, Reply 172.18.0.2 is-at 02:42:ac:12:00:02, length 28
15:31:29.257026 ARP, Reply 172.18.0.2 is-at 02:42:ac:12:00:02, length 28
15:31:31.048857 IP 172.18.0.2.48274 > 142.250.148.28.465: Flags [.], seq 884:2302, ack 5405, win 501, options [nop,nop,TS val 2220290580 ecr 212964498], length 1418
15:31:31.048869 IP 172.18.0.2.48274 > 142.250.148.28.465: Flags [.], seq 884:2302, ack 5405, win 501, options [nop,nop,TS val 2220290580 ecr 212964498], length 1418
15:31:37.704873 IP 172.18.0.2.48274 > 142.250.148.28.465: Flags [.], seq 884:2302, ack 5405, win 501, options [nop,nop,TS val 2220297236 ecr 212964498], length 1418
15:31:37.704884 IP 172.18.0.2.48274 > 142.250.148.28.465: Flags [.], seq 884:2302, ack 5405, win 501, options [nop,nop,TS val 2220297236 ecr 212964498], length 1418
15:31:51.016851 IP 172.18.0.2.48274 > 142.250.148.28.465: Flags [.], seq 884:2302, ack 5405, win 501, options [nop,nop,TS val 2220310548 ecr 212964498], length 1418
15:31:51.016863 IP 172.18.0.2.48274 > 142.250.148.28.465: Flags [.], seq 884:2302, ack 5405, win 501, options [nop,nop,TS val 2220310548 ecr 212964498], length 1418
15:31:54.108810 IP 172.18.0.2.80 > 172.18.0.1.59036: Flags [.], ack 1343, win 501, options [nop,nop,TS val 3230489982 ecr 1194004041], length 0
15:31:54.108819 IP 172.18.0.2.80 > 172.18.0.1.59036: Flags [.], ack 1343, win 501, options [nop,nop,TS val 3230489982 ecr 1194004041], length 0
15:31:54.856926 IP 172.18.0.2.48274 > 142.250.148.28.465: Flags [FP.], seq 16482:17164, ack 5405, win 501, options [nop,nop,TS val 2220314388 ecr 212964498], length 682
15:31:54.856936 IP 172.18.0.2.48274 > 142.250.148.28.465: Flags [FP.], seq 16482:17164, ack 5405, win 501, options [nop,nop,TS val 2220314388 ecr 212964498], length 682
15:31:54.858236 IP 172.18.0.2.48274 > 142.250.148.28.465: Flags [.], seq 884:2302, ack 5405, win 501, options [nop,nop,TS val 2220314390 ecr 212994578], length 1418
15:31:54.858241 IP 172.18.0.2.48274 > 142.250.148.28.465: Flags [.], seq 884:2302, ack 5405, win 501, options [nop,nop,TS val 2220314390 ecr 212994578], length 1418
15:31:54.858317 IP 172.18.0.2.80 > 172.18.0.1.59036: Flags [P.], seq 1:1094, ack 1343, win 501, options [nop,nop,TS val 3230490732 ecr 1194004041], length 1093: HTTP: HTTP/1.1 400 Bad Request
15:31:54.858320 IP 172.18.0.2.80 > 172.18.0.1.59036: Flags [P.], seq 1:1094, ack 1343, win 501, options [nop,nop,TS val 3230490732 ecr 1194004041], length 1093: HTTP: HTTP/1.1 400 Bad Request
15:31:54.858360 IP 172.18.0.2.80 > 172.18.0.1.59036: Flags [F.], seq 1094, ack 1343, win 501, options [nop,nop,TS val 3230490732 ecr 1194004833], length 0
15:31:54.858361 IP 172.18.0.2.80 > 172.18.0.1.59036: Flags [F.], seq 1094, ack 1343, win 501, options [nop,nop,TS val 3230490732 ecr 1194004833], length 0
15:31:55.064883 IP 172.18.0.2.48274 > 142.250.148.28.465: Flags [.], seq 884:2302, ack 5405, win 501, options [nop,nop,TS val 2220314596 ecr 212994578], length 1418
15:31:55.064899 IP 172.18.0.2.48274 > 142.250.148.28.465: Flags [.], seq 884:2302, ack 5405, win 501, options [nop,nop,TS val 2220314596 ecr 212994578], length 1418
15:31:55.496857 IP 172.18.0.2.48274 > 142.250.148.28.465: Flags [.], seq 884:2302, ack 5405, win 501, options [nop,nop,TS val 2220315028 ecr 212994578], length 1418
15:31:55.496868 IP 172.18.0.2.48274 > 142.250.148.28.465: Flags [.], seq 884:2302, ack 5405, win 501, options [nop,nop,TS val 2220315028 ecr 212994578], length 1418
15:31:56.332867 IP 172.18.0.2.48274 > 142.250.148.28.465: Flags [.], seq 884:2302, ack 5405, win 501, options [nop,nop,TS val 2220315864 ecr 212994578], length 1418
15:31:56.332881 IP 172.18.0.2.48274 > 142.250.148.28.465: Flags [.], seq 884:2302, ack 5405, win 501, options [nop,nop,TS val 2220315864 ecr 212994578], length 1418
15:31:57.992862 IP 172.18.0.2.48274 > 142.250.148.28.465: Flags [.], seq 884:2302, ack 5405, win 501, options [nop,nop,TS val 2220317524 ecr 212994578], length 1418
15:31:57.992874 IP 172.18.0.2.48274 > 142.250.148.28.465: Flags [.], seq 884:2302, ack 5405, win 501, options [nop,nop,TS val 2220317524 ecr 212994578], length 1418
```

**Reply by ninjamonkey198206** [reply]
Taken from my home server, using the same email config, and the same capture method.

```text
As source

16:09:53.218198 IP 172.19.0.10.80 > 10.0.2.1.15941: Flags [S.], seq 544630212, ack 2896577567, win 65160, options [mss 1460,sackOK,TS val 2007010064 ecr 1954901935,nop,wscale 7], length 0
16:09:53.218198 IP 172.19.0.10.80 > 10.0.2.1.15941: Flags [S.], seq 544630212, ack 2896577567, win 65160, options [mss 1460,sackOK,TS val 2007010064 ecr 1954901935,nop,wscale 7], length 0
16:09:53.218605 IP 172.19.0.10.80 > 10.0.2.1.15941: Flags [.], ack 1350, win 499, options [nop,nop,TS val 2007010065 ecr 1954901937], length 0
16:09:53.218605 IP 172.19.0.10.80 > 10.0.2.1.15941: Flags [.], ack 1350, win 499, options [nop,nop,TS val 2007010065 ecr 1954901937], length 0
16:09:53.438806 IP 172.19.0.10.53306 > 142.250.113.28.465: Flags [S], seq 3553225944, win 64240, options [mss 1460,sackOK,TS val 2486245821 ecr 0,nop,wscale 7], length 0
16:09:53.438806 IP 172.19.0.10.53306 > 142.250.113.28.465: Flags [S], seq 3553225944, win 64240, options [mss 1460,sackOK,TS val 2486245821 ecr 0,nop,wscale 7], length 0
16:09:53.458660 IP 172.19.0.10.53306 > 142.250.113.28.465: Flags [.], ack 3733749679, win 502, options [nop,nop,TS val 2486245841 ecr 1887621017], length 0
16:09:53.458660 IP 172.19.0.10.53306 > 142.250.113.28.465: Flags [.], ack 1, win 502, options [nop,nop,TS val 2486245841 ecr 1887621017], length 0
16:09:53.458909 IP 172.19.0.10.53306 > 142.250.113.28.465: Flags [P.], seq 0:517, ack 1, win 502, options [nop,nop,TS val 2486245841 ecr 1887621017], length 517
16:09:53.458909 IP 172.19.0.10.53306 > 142.250.113.28.465: Flags [P.], seq 0:517, ack 1, win 502, options [nop,nop,TS val 2486245841 ecr 1887621017], length 517
16:09:53.478781 IP 172.19.0.10.53306 > 142.250.113.28.465: Flags [.], ack 1419, win 495, options [nop,nop,TS val 2486245861 ecr 1887621037], length 0
16:09:53.478781 IP 172.19.0.10.53306 > 142.250.113.28.465: Flags [.], ack 1419, win 495, options [nop,nop,TS val 2486245861 ecr 1887621037], length 0
16:09:53.478817 IP 172.19.0.10.53306 > 142.250.113.28.465: Flags [.], ack 4308, win 473, options [nop,nop,TS val 2486245861 ecr 1887621037], length 0
16:09:53.478817 IP 172.19.0.10.53306 > 142.250.113.28.465: Flags [.], ack 4308, win 473, options [nop,nop,TS val 2486245861 ecr 1887621037], length 0
16:09:53.480031 IP 172.19.0.10.53306 > 142.250.113.28.465: Flags [P.], seq 517:597, ack 4308, win 501, options [nop,nop,TS val 2486245862 ecr 1887621037], length 80
16:09:53.480031 IP 172.19.0.10.53306 > 142.250.113.28.465: Flags [P.], seq 517:597, ack 4308, win 501, options [nop,nop,TS val 2486245862 ecr 1887621037], length 80
16:09:53.535222 IP 172.19.0.10.53306 > 142.250.113.28.465: Flags [.], ack 4926, win 497, options [nop,nop,TS val 2486245917 ecr 1887621094], length 0
16:09:53.535222 IP 172.19.0.10.53306 > 142.250.113.28.465: Flags [.], ack 4926, win 497, options [nop,nop,TS val 2486245917 ecr 1887621094], length 0
16:09:53.535338 IP 172.19.0.10.53306 > 142.250.113.28.465: Flags [P.], seq 597:635, ack 4926, win 501, options [nop,nop,TS val 2486245917 ecr 1887621094], length 38
16:09:53.535338 IP 172.19.0.10.53306 > 142.250.113.28.465: Flags [P.], seq 597:635, ack 4926, win 501, options [nop,nop,TS val 2486245917 ecr 1887621094], length 38
16:09:53.563959 IP 172.19.0.10.53306 > 142.250.113.28.465: Flags [.], ack 5177, win 500, options [nop,nop,TS val 2486245946 ecr 1887621123], length 0
16:09:53.563959 IP 172.19.0.10.53306 > 142.250.113.28.465: Flags [.], ack 5177, win 500, options [nop,nop,TS val 2486245946 ecr 1887621123], length 0
16:09:53.564041 IP 172.19.0.10.53306 > 142.250.113.28.465: Flags [P.], seq 635:734, ack 5177, win 501, options [nop,nop,TS val 2486245946 ecr 1887621123], length 99
16:09:53.564041 IP 172.19.0.10.53306 > 142.250.113.28.465: Flags [P.], seq 635:734, ack 5177, win 501, options [nop,nop,TS val 2486245946 ecr 1887621123], length 99
16:09:53.758984 IP 172.19.0.10.53306 > 142.250.113.28.465: Flags [P.], seq 734:798, ack 5219, win 501, options [nop,nop,TS val 2486246141 ecr 1887621318], length 64
16:09:53.758984 IP 172.19.0.10.53306 > 142.250.113.28.465: Flags [P.], seq 734:798, ack 5219, win 501, options [nop,nop,TS val 2486246141 ecr 1887621318], length 64
16:09:53.785934 IP 172.19.0.10.53306 > 142.250.113.28.465: Flags [P.], seq 798:857, ack 5281, win 501, options [nop,nop,TS val 2486246168 ecr 1887621345], length 59
16:09:53.785934 IP 172.19.0.10.53306 > 142.250.113.28.465: Flags [P.], seq 798:857, ack 5281, win 501, options [nop,nop,TS val 2486246168 ecr 1887621345], length 59
16:09:53.808522 IP 172.19.0.10.53306 > 142.250.113.28.465: Flags [P.], seq 857:885, ack 5343, win 501, options [nop,nop,TS val 2486246191 ecr 1887621367], length 28
16:09:53.808522 IP 172.19.0.10.53306 > 142.250.113.28.465: Flags [P.], seq 857:885, ack 5343, win 501, options [nop,nop,TS val 2486246191 ecr 1887621367], length 28
16:09:54.248918 IP 172.19.0.10.53306 > 142.250.113.28.465: Flags [P.], seq 885:3721, ack 5406, win 501, options [nop,nop,TS val 2486246631 ecr 1887621808], length 2836
16:09:54.248918 IP 172.19.0.10.53306 > 142.250.113.28.465: Flags [P.], seq 885:3721, ack 5406, win 501, options [nop,nop,TS val 2486246631 ecr 1887621808], length 2836
16:09:54.248938 IP 172.19.0.10.53306 > 142.250.113.28.465: Flags [P.], seq 3721:6557, ack 5406, win 501, options [nop,nop,TS val 2486246631 ecr 1887621808], length 2836
16:09:54.248938 IP 172.19.0.10.53306 > 142.250.113.28.465: Flags [P.], seq 3721:6557, ack 5406, win 501, options [nop,nop,TS val 2486246631 ecr 1887621808], length 2836
16:09:54.248948 IP 172.19.0.10.53306 > 142.250.113.28.465: Flags [P.], seq 6557:9393, ack 5406, win 501, options [nop,nop,TS val 2486246631 ecr 1887621808], length 2836
16:09:54.248948 IP 172.19.0.10.53306 > 142.250.113.28.465: Flags [P.], seq 6557:9393, ack 5406, win 501, options [nop,nop,TS val 2486246631 ecr 1887621808], length 2836
16:09:54.248957 IP 172.19.0.10.53306 > 142.250.113.28.465: Flags [P.], seq 9393:12229, ack 5406, win 501, options [nop,nop,TS val 2486246631 ecr 1887621808], length 2836
16:09:54.248957 IP 172.19.0.10.53306 > 142.250.113.28.465: Flags [P.], seq 9393:12229, ack 5406, win 501, options [nop,nop,TS val 2486246631 ecr 1887621808], length 2836
16:09:54.248966 IP 172.19.0.10.53306 > 142.250.113.28.465: Flags [P.], seq 12229:15065, ack 5406, win 501, options [nop,nop,TS val 2486246631 ecr 1887621808], length 2836
16:09:54.248966 IP 172.19.0.10.53306 > 142.250.113.28.465: Flags [P.], seq 12229:15065, ack 5406, win 501, options [nop,nop,TS val 2486246631 ecr 1887621808], length 2836
16:09:54.267318 IP 172.19.0.10.53306 > 142.250.113.28.465: Flags [P.], seq 15065:17141, ack 5406, win 501, options [nop,nop,TS val 2486246649 ecr 1887621827], length 2076
16:09:54.267318 IP 172.19.0.10.53306 > 142.250.113.28.465: Flags [P.], seq 15065:17141, ack 5406, win 501, options [nop,nop,TS val 2486246649 ecr 1887621827], length 2076
16:09:54.357499 IP 172.19.0.10.53306 > 142.250.113.28.465: Flags [P.], seq 17141:17169, ack 5480, win 501, options [nop,nop,TS val 2486246740 ecr 1887621917], length 28
16:09:54.357499 IP 172.19.0.10.53306 > 142.250.113.28.465: Flags [P.], seq 17141:17169, ack 5480, win 501, options [nop,nop,TS val 2486246740 ecr 1887621917], length 28
16:09:54.378135 IP 172.19.0.10.53306 > 142.250.113.28.465: Flags [F.], seq 17169, ack 5558, win 501, options [nop,nop,TS val 2486246760 ecr 1887621937], length 0
16:09:54.378135 IP 172.19.0.10.53306 > 142.250.113.28.465: Flags [F.], seq 17169, ack 5558, win 501, options [nop,nop,TS val 2486246760 ecr 1887621937], length 0
16:09:54.379407 IP 172.19.0.10.80 > 10.0.2.1.15941: Flags [P.], seq 1:895, ack 1350, win 501, options [nop,nop,TS val 2007011225 ecr 1954901937], length 894: HTTP: HTTP/1.1 200 OK
16:09:54.379407 IP 172.19.0.10.80 > 10.0.2.1.15941: Flags [P.], seq 1:895, ack 1350, win 501, options [nop,nop,TS val 2007011225 ecr 1954901937], length 894: HTTP: HTTP/1.1 200 OK
16:09:54.379443 IP 172.19.0.10.80 > 10.0.2.1.15941: Flags [F.], seq 895, ack 1350, win 501, options [nop,nop,TS val 2007011225 ecr 1954901937], length 0
16:09:54.379443 IP 172.19.0.10.80 > 10.0.2.1.15941: Flags [F.], seq 895, ack 1350, win 501, options [nop,nop,TS val 2007011225 ecr 1954901937], length 0
16:09:54.424575 IP 172.19.0.10.53306 > 142.250.113.28.465: Flags [.], ack 5559, win 501, options [nop,nop,TS val 2486246807 ecr 1887621937], length 0
16:09:54.424575 IP 172.19.0.10.53306 > 142.250.113.28.465: Flags [.], ack 5559, win 501, options [nop,nop,TS val 2486246807 ecr 1887621937], length 0
16:09:54.424580 IP 172.19.0.10.53306 > 142.250.113.28.465: Flags [.], ack 5559, win 501, options [nop,nop,TS val 2486246807 ecr 1887621976,nop,nop,sack 1 {5558:5559}], length 0
16:09:54.424580 IP 172.19.0.10.53306 > 142.250.113.28.465: Flags [.], ack 5559, win 501, options [nop,nop,TS val 2486246807 ecr 1887621976,nop,nop,sack 1 {5558:5559}], length 0


As destination

16:09:53.218147 IP 10.0.2.1.15941 > 172.19.0.10.80: Flags [S], seq 2896577566, win 65228, options [mss 1460,nop,wscale 7,sackOK,TS val 1954901935 ecr 0], length 0
16:09:53.218154 IP 10.0.2.1.15941 > 172.19.0.10.80: Flags [S], seq 2896577566, win 65228, options [mss 1460,nop,wscale 7,sackOK,TS val 1954901935 ecr 0], length 0
16:09:53.218468 IP 10.0.2.1.15941 > 172.19.0.10.80: Flags [.], ack 544630213, win 514, options [nop,nop,TS val 1954901937 ecr 2007010064], length 0
16:09:53.218470 IP 10.0.2.1.15941 > 172.19.0.10.80: Flags [.], ack 1, win 514, options [nop,nop,TS val 1954901937 ecr 2007010064], length 0
16:09:53.218588 IP 10.0.2.1.15941 > 172.19.0.10.80: Flags [P.], seq 0:1349, ack 1, win 514, options [nop,nop,TS val 1954901937 ecr 2007010064], length 1349: HTTP: POST /admin/test/smtp/ HTTP/1.1
16:09:53.218591 IP 10.0.2.1.15941 > 172.19.0.10.80: Flags [P.], seq 0:1349, ack 1, win 514, options [nop,nop,TS val 1954901937 ecr 2007010064], length 1349: HTTP: POST /admin/test/smtp/ HTTP/1.1
16:09:53.458621 IP 142.250.113.28.465 > 172.19.0.10.53306: Flags [S.], seq 3733749678, ack 3553225945, win 65535, options [mss 1430,sackOK,TS val 1887621017 ecr 2486245821,nop,wscale 8], length 0
16:09:53.458626 IP 142.250.113.28.465 > 172.19.0.10.53306: Flags [S.], seq 3733749678, ack 3553225945, win 65535, options [mss 1430,sackOK,TS val 1887621017 ecr 2486245821,nop,wscale 8], length 0
16:09:53.478490 IP 142.250.113.28.465 > 172.19.0.10.53306: Flags [.], ack 518, win 261, options [nop,nop,TS val 1887621036 ecr 2486245841], length 0
16:09:53.478493 IP 142.250.113.28.465 > 172.19.0.10.53306: Flags [.], ack 518, win 261, options [nop,nop,TS val 1887621036 ecr 2486245841], length 0
16:09:53.478762 IP 142.250.113.28.465 > 172.19.0.10.53306: Flags [.], seq 1:1419, ack 518, win 261, options [nop,nop,TS val 1887621037 ecr 2486245841], length 1418
16:09:53.478763 IP 142.250.113.28.465 > 172.19.0.10.53306: Flags [.], seq 1:1419, ack 518, win 261, options [nop,nop,TS val 1887621037 ecr 2486245841], length 1418
16:09:53.478807 IP 142.250.113.28.465 > 172.19.0.10.53306: Flags [P.], seq 1419:4308, ack 518, win 261, options [nop,nop,TS val 1887621037 ecr 2486245841], length 2889
16:09:53.478809 IP 142.250.113.28.465 > 172.19.0.10.53306: Flags [P.], seq 1419:4308, ack 518, win 261, options [nop,nop,TS val 1887621037 ecr 2486245841], length 2889
16:09:53.500680 IP 142.250.113.28.465 > 172.19.0.10.53306: Flags [.], ack 598, win 261, options [nop,nop,TS val 1887621060 ecr 2486245862], length 0
16:09:53.500682 IP 142.250.113.28.465 > 172.19.0.10.53306: Flags [.], ack 598, win 261, options [nop,nop,TS val 1887621060 ecr 2486245862], length 0
16:09:53.535211 IP 142.250.113.28.465 > 172.19.0.10.53306: Flags [P.], seq 4308:4926, ack 598, win 261, options [nop,nop,TS val 1887621094 ecr 2486245862], length 618
16:09:53.535213 IP 142.250.113.28.465 > 172.19.0.10.53306: Flags [P.], seq 4308:4926, ack 598, win 261, options [nop,nop,TS val 1887621094 ecr 2486245862], length 618
16:09:53.558619 IP 142.250.113.28.465 > 172.19.0.10.53306: Flags [.], ack 636, win 261, options [nop,nop,TS val 1887621118 ecr 2486245917], length 0
16:09:53.558621 IP 142.250.113.28.465 > 172.19.0.10.53306: Flags [.], ack 636, win 261, options [nop,nop,TS val 1887621118 ecr 2486245917], length 0
16:09:53.563948 IP 142.250.113.28.465 > 172.19.0.10.53306: Flags [P.], seq 4926:5177, ack 636, win 261, options [nop,nop,TS val 1887621123 ecr 2486245917], length 251
16:09:53.563951 IP 142.250.113.28.465 > 172.19.0.10.53306: Flags [P.], seq 4926:5177, ack 636, win 261, options [nop,nop,TS val 1887621123 ecr 2486245917], length 251
16:09:53.590857 IP 142.250.113.28.465 > 172.19.0.10.53306: Flags [.], ack 735, win 261, options [nop,nop,TS val 1887621150 ecr 2486245946], length 0
16:09:53.590860 IP 142.250.113.28.465 > 172.19.0.10.53306: Flags [.], ack 735, win 261, options [nop,nop,TS val 1887621150 ecr 2486245946], length 0
16:09:53.758917 IP 142.250.113.28.465 > 172.19.0.10.53306: Flags [P.], seq 5177:5219, ack 735, win 261, options [nop,nop,TS val 1887621318 ecr 2486245946], length 42
16:09:53.758919 IP 142.250.113.28.465 > 172.19.0.10.53306: Flags [P.], seq 5177:5219, ack 735, win 261, options [nop,nop,TS val 1887621318 ecr 2486245946], length 42
16:09:53.773802 IP 142.250.113.28.465 > 172.19.0.10.53306: Flags [.], ack 799, win 261, options [nop,nop,TS val 1887621333 ecr 2486246141], length 0
16:09:53.773804 IP 142.250.113.28.465 > 172.19.0.10.53306: Flags [.], ack 799, win 261, options [nop,nop,TS val 1887621333 ecr 2486246141], length 0
16:09:53.785881 IP 142.250.113.28.465 > 172.19.0.10.53306: Flags [P.], seq 5219:5281, ack 799, win 261, options [nop,nop,TS val 1887621345 ecr 2486246141], length 62
16:09:53.785883 IP 142.250.113.28.465 > 172.19.0.10.53306: Flags [P.], seq 5219:5281, ack 799, win 261, options [nop,nop,TS val 1887621345 ecr 2486246141], length 62
16:09:53.806115 IP 142.250.113.28.465 > 172.19.0.10.53306: Flags [.], ack 858, win 261, options [nop,nop,TS val 1887621365 ecr 2486246168], length 0
16:09:53.806117 IP 142.250.113.28.465 > 172.19.0.10.53306: Flags [.], ack 858, win 261, options [nop,nop,TS val 1887621365 ecr 2486246168], length 0
16:09:53.808470 IP 142.250.113.28.465 > 172.19.0.10.53306: Flags [P.], seq 5281:5343, ack 858, win 261, options [nop,nop,TS val 1887621367 ecr 2486246168], length 62
16:09:53.808473 IP 142.250.113.28.465 > 172.19.0.10.53306: Flags [P.], seq 5281:5343, ack 858, win 261, options [nop,nop,TS val 1887621367 ecr 2486246168], length 62
16:09:53.830701 IP 142.250.113.28.465 > 172.19.0.10.53306: Flags [.], ack 886, win 261, options [nop,nop,TS val 1887621390 ecr 2486246191], length 0
16:09:53.830703 IP 142.250.113.28.465 > 172.19.0.10.53306: Flags [.], ack 886, win 261, options [nop,nop,TS val 1887621390 ecr 2486246191], length 0
16:09:54.248822 IP 142.250.113.28.465 > 172.19.0.10.53306: Flags [P.], seq 5343:5406, ack 886, win 261, options [nop,nop,TS val 1887621808 ecr 2486246191], length 63
16:09:54.248824 IP 142.250.113.28.465 > 172.19.0.10.53306: Flags [P.], seq 5343:5406, ack 886, win 261, options [nop,nop,TS val 1887621808 ecr 2486246191], length 63
16:09:54.267301 IP 142.250.113.28.465 > 172.19.0.10.53306: Flags [.], ack 2304, win 272, options [nop,nop,TS val 1887621827 ecr 2486246631], length 0
16:09:54.267303 IP 142.250.113.28.465 > 172.19.0.10.53306: Flags [.], ack 2304, win 272, options [nop,nop,TS val 1887621827 ecr 2486246631], length 0
16:09:54.267306 IP 142.250.113.28.465 > 172.19.0.10.53306: Flags [.], ack 3722, win 283, options [nop,nop,TS val 1887621827 ecr 2486246631], length 0
16:09:54.267307 IP 142.250.113.28.465 > 172.19.0.10.53306: Flags [.], ack 3722, win 283, options [nop,nop,TS val 1887621827 ecr 2486246631], length 0
16:09:54.268521 IP 142.250.113.28.465 > 172.19.0.10.53306: Flags [.], ack 5140, win 294, options [nop,nop,TS val 1887621828 ecr 2486246631], length 0
16:09:54.268523 IP 142.250.113.28.465 > 172.19.0.10.53306: Flags [.], ack 5140, win 294, options [nop,nop,TS val 1887621828 ecr 2486246631], length 0
16:09:54.268526 IP 142.250.113.28.465 > 172.19.0.10.53306: Flags [.], ack 6558, win 305, options [nop,nop,TS val 1887621828 ecr 2486246631], length 0
16:09:54.268526 IP 142.250.113.28.465 > 172.19.0.10.53306: Flags [.], ack 6558, win 305, options [nop,nop,TS val 1887621828 ecr 2486246631], length 0
16:09:54.268543 IP 142.250.113.28.465 > 172.19.0.10.53306: Flags [.], ack 7976, win 316, options [nop,nop,TS val 1887621828 ecr 2486246631], length 0
16:09:54.268544 IP 142.250.113.28.465 > 172.19.0.10.53306: Flags [.], ack 7976, win 316, options [nop,nop,TS val 1887621828 ecr 2486246631], length 0
16:09:54.273502 IP 142.250.113.28.465 > 172.19.0.10.53306: Flags [.], ack 9394, win 327, options [nop,nop,TS val 1887621833 ecr 2486246631], length 0
16:09:54.273504 IP 142.250.113.28.465 > 172.19.0.10.53306: Flags [.], ack 9394, win 327, options [nop,nop,TS val 1887621833 ecr 2486246631], length 0
16:09:54.273507 IP 142.250.113.28.465 > 172.19.0.10.53306: Flags [.], ack 10812, win 338, options [nop,nop,TS val 1887621833 ecr 2486246631], length 0
16:09:54.273507 IP 142.250.113.28.465 > 172.19.0.10.53306: Flags [.], ack 10812, win 338, options [nop,nop,TS val 1887621833 ecr 2486246631], length 0
16:09:54.274709 IP 142.250.113.28.465 > 172.19.0.10.53306: Flags [.], ack 12230, win 349, options [nop,nop,TS val 1887621834 ecr 2486246631], length 0
16:09:54.274711 IP 142.250.113.28.465 > 172.19.0.10.53306: Flags [.], ack 12230, win 349, options [nop,nop,TS val 1887621834 ecr 2486246631], length 0
16:09:54.274713 IP 142.250.113.28.465 > 172.19.0.10.53306: Flags [.], ack 13648, win 360, options [nop,nop,TS val 1887621834 ecr 2486246631], length 0
16:09:54.274714 IP 142.250.113.28.465 > 172.19.0.10.53306: Flags [.], ack 13648, win 360, options [nop,nop,TS val 1887621834 ecr 2486246631], length 0
16:09:54.274731 IP 142.250.113.28.465 > 172.19.0.10.53306: Flags [.], ack 15066, win 371, options [nop,nop,TS val 1887621834 ecr 2486246631], length 0
16:09:54.274732 IP 142.250.113.28.465 > 172.19.0.10.53306: Flags [.], ack 15066, win 371, options [nop,nop,TS val 1887621834 ecr 2486246631], length 0
16:09:54.285280 IP 142.250.113.28.465 > 172.19.0.10.53306: Flags [.], ack 16484, win 383, options [nop,nop,TS val 1887621845 ecr 2486246649], length 0
16:09:54.285282 IP 142.250.113.28.465 > 172.19.0.10.53306: Flags [.], ack 16484, win 383, options [nop,nop,TS val 1887621845 ecr 2486246649], length 0
16:09:54.285285 IP 142.250.113.28.465 > 172.19.0.10.53306: Flags [.], ack 17142, win 394, options [nop,nop,TS val 1887621845 ecr 2486246649], length 0
16:09:54.285285 IP 142.250.113.28.465 > 172.19.0.10.53306: Flags [.], ack 17142, win 394, options [nop,nop,TS val 1887621845 ecr 2486246649], length 0
16:09:54.357447 IP 142.250.113.28.465 > 172.19.0.10.53306: Flags [P.], seq 5406:5480, ack 17142, win 394, options [nop,nop,TS val 1887621917 ecr 2486246649], length 74
16:09:54.357449 IP 142.250.113.28.465 > 172.19.0.10.53306: Flags [P.], seq 5406:5480, ack 17142, win 394, options [nop,nop,TS val 1887621917 ecr 2486246649], length 74
16:09:54.370703 IP 142.250.113.28.465 > 172.19.0.10.53306: Flags [.], ack 17170, win 394, options [nop,nop,TS val 1887621930 ecr 2486246740], length 0
16:09:54.370706 IP 142.250.113.28.465 > 172.19.0.10.53306: Flags [.], ack 17170, win 394, options [nop,nop,TS val 1887621930 ecr 2486246740], length 0
16:09:54.378087 IP 142.250.113.28.465 > 172.19.0.10.53306: Flags [P.], seq 5480:5558, ack 17170, win 394, options [nop,nop,TS val 1887621937 ecr 2486246740], length 78
16:09:54.378090 IP 142.250.113.28.465 > 172.19.0.10.53306: Flags [P.], seq 5480:5558, ack 17170, win 394, options [nop,nop,TS val 1887621937 ecr 2486246740], length 78
16:09:54.379744 IP 10.0.2.1.15941 > 172.19.0.10.80: Flags [.], ack 895, win 508, options [nop,nop,TS val 1954903098 ecr 2007011225], length 0
16:09:54.379750 IP 10.0.2.1.15941 > 172.19.0.10.80: Flags [.], ack 895, win 508, options [nop,nop,TS val 1954903098 ecr 2007011225], length 0
16:09:54.379755 IP 10.0.2.1.15941 > 172.19.0.10.80: Flags [.], ack 896, win 508, options [nop,nop,TS val 1954903098 ecr 2007011225], length 0
16:09:54.379756 IP 10.0.2.1.15941 > 172.19.0.10.80: Flags [.], ack 896, win 508, options [nop,nop,TS val 1954903098 ecr 2007011225], length 0
16:09:54.379803 IP 10.0.2.1.15941 > 172.19.0.10.80: Flags [R.], seq 1349, ack 896, win 0, options [nop,nop,TS val 1954903098 ecr 2007011225], length 0
16:09:54.379804 IP 10.0.2.1.15941 > 172.19.0.10.80: Flags [R.], seq 1349, ack 896, win 0, options [nop,nop,TS val 1954903098 ecr 2007011225], length 0
16:09:54.424560 IP 142.250.113.28.465 > 172.19.0.10.53306: Flags [F.], seq 5558, ack 17170, win 394, options [nop,nop,TS val 1887621937 ecr 2486246740], length 0
16:09:54.424562 IP 142.250.113.28.465 > 172.19.0.10.53306: Flags [F.], seq 5558, ack 17170, win 394, options [nop,nop,TS val 1887621937 ecr 2486246740], length 0
16:09:54.424565 IP 142.250.113.28.465 > 172.19.0.10.53306: Flags [F.], seq 5558, ack 17170, win 394, options [nop,nop,TS val 1887621976 ecr 2486246740], length 0
16:09:54.424565 IP 142.250.113.28.465 > 172.19.0.10.53306: Flags [F.], seq 5558, ack 17170, win 394, options [nop,nop,TS val 1887621976 ecr 2486246740], length 0
16:09:54.440656 IP 142.250.113.28.465 > 172.19.0.10.53306: Flags [.], ack 17171, win 394, options [nop,nop,TS val 1887621998 ecr 2486246760], length 0
16:09:54.440658 IP 142.250.113.28.465 > 172.19.0.10.53306: Flags [.], ack 17171, win 394, options [nop,nop,TS val 1887621998 ecr 2486246760], length 0
```

**Reply by ninjamonkey198206** [reply]
I can see differences in the process, but I've got no idea what they mean.

**Reply by ninjamonkey198206** [reply]
From inside the Vaultwarden container:
```text
openssl s_client -connect smtp-relay.gmail.com:465 -tls1 -crlf

220 smtp-relay.gmail.com ESMTP nu10sm3770228pjb.3 - gsmtp
HELO example.com
250 smtp-relay.gmail.com at your service
auth plain blahblah
235 2.7.0 Accepted
mail from: <mail@example.com>
250 2.1.0 OK nu10sm3770228pjb.3 - gsmtp
rcpt to: <example@gmail.com>
250 2.1.5 OK nu10sm3770228pjb.3 - gsmtp
data
354  Go ahead nu10sm3770228pjb.3 - gsmtp
From: vaultwarden@example.com
This is a test
.
250 2.0.0 OK  1634509986 nu10sm3770228pjb.3 - gsmtp
```
Email was delivered.

Still won't send the test email from the admin console.

**Reply by ninjamonkey198206** [reply]
Testing with TLS 1.2 and 1.3 options

**Reply by ninjamonkey198206** [reply]
Those work fine.
The one thing I did notice is that if I left off the -crlf flag when using the command above, Google's server didn't recognize the . to finish, nor the quit command.
I don't know if that is relevant or not.

And according to a few pages, the rcpt to has to be lowercase when communicating with Google's servers because a capital R resets the connection.

Gonna go take something for the headache I've got now.

**Reply by BlackDex** [reply]
Regarding the `-crlf`, if i'm correct, but @paolobarbolini should correct me if i'm wrong, that is exactly what lettre is sending.
So, with `-crlf` is the correct way, and should represent the same as is done with lettre.

**Reply by ninjamonkey198206** [reply]
For giggles I entered the exact info into the admin page as I used for the openssl test above, including the HELO, From, and auth selection, it still gave me the finger.

Looked through the code for Vaultwarden and looked through any file with a name that referenced mail, but I didn't see anything that jumped out at me that could be a problem, though I'm not familiar with any of the languages so that likely wasn't very helpful.

**Reply by ninjamonkey198206** [reply]
So we've verified that manually sending an email using the openssl command to connect from within the container works for a simple plain text message.

According to the output from a few posts up Vaultwarden sends non-plain-text, and it's sending the quit command without getting the 250 ok message in response after the .

Maybe something in the Data section is tripping it up? I don't see why it would, but I'll try using some of that during a manual openssl test from inside the container.

**Reply by ninjamonkey198206** [reply]
Just noticed one potential issue. In the debug data the commands are capitalized. MAIL FROM, and the one that can throw a wrench in the works, RCPT TO.
Apparently it's not 100% of the time, but as I mentioned earlier it can cause errors when using Google's email services. If possible I'd change the commands starting with MAIL FROM to lower case to prevent any problems, or at least RCPT TO.

This is what happens:
```text
openssl s_client -connect smtp-relay.gmail.com:465 -tls1_3 -crlf

220 smtp-relay.gmail.com ESMTP f5sm4865731qko.7 - gsmtp

EHLO example.com

250-smtp-relay.gmail.com at your service, [34.68.199.125]
250-SIZE 157286400
250-8BITMIME
250-AUTH LOGIN PLAIN XOAUTH2 PLAIN-CLIENTTOKEN OAUTHBEARER XOAUTH
250-ENHANCEDSTATUSCODES
250-PIPELINING
250-CHUNKING
250 SMTPUTF8

auth plain blahblah
235 2.7.0 Accepted

MAIL FROM: <mail@example.com>
250 2.1.0 OK i28sm4334070ood.13 - gsmtp

RCPT TO: <example@gmail.com>
RENEGOTIATING
139950794630272:error:1420410A:SSL routines:SSL_renegotiate:wrong ssl version:../ssl/ssl_lib.c:2133:
```

**Reply by paolobarbolini** [reply]
I think the `RENEGOTIATING` you see there is openssl [^1]. What you can do is launch it with the `-quiet` option

[^1]: https://man.openbsd.org/openssl.1#Q

**Reply by ninjamonkey198206** [reply]
Tried with lowercase commands and used some of the message output from the debug output:
```text
220 smtp-relay.gmail.com ESMTP v5sm7303356qkp.0 - gsmtp
EHLO example.com
250-smtp-relay.gmail.com at your service, [34.68.199.125]
250-SIZE 157286400
250-8BITMIME
250-AUTH LOGIN PLAIN XOAUTH2 PLAIN-CLIENTTOKEN OAUTHBEARER XOAUTH
250-ENHANCEDSTATUSCODES
250-PIPELINING
250-CHUNKING
250 SMTPUTF8
auth plain blahblah
235 2.7.0 Accepted
mail from: <mail@example.com>
250 2.1.0 OK v5sm7303356qkp.0 - gsmtp
rcpt to: <example@gmail.com>
250 2.1.5 OK v5sm7303356qkp.0 - gsmtp
data
354  Go ahead v5sm7303356qkp.0 - gsmtp
Message-ID: <ed90fc3f-bf15-420e-902c-1cede6f5bebe@example.com>
To: example@gmail.com
From: vaultwarden@example.com <mail@example.com>
Subject: Vaultwarden SMTP Test
MIME-Version: 1.0
Content-Type: multipart/alternative;
boundary="iLePJ00w6AbvX6b3LZWjcAAT5z9FJz90mSdS2sWi"
--iLePJ00w6AbvX6b3LZWjcAAT5z9FJz90mSdS2sWi
Content-Transfer-Encoding: base64
Content-Type: text/plain; charset=utf-8
VGhpcyBpcyBhIHRlc3QgZW1haWwgdG8gdmVyaWZ5IHRoZSBTTVRQIGNvbmZpZ3VyYXRpb24gZm9y
IGh0dHBzOi8vYml0d2FyZGVuLnJlbnRhbmVyZGNvbnN1bHRpbmcuY29tLg0KDQpXaGVuIHlvdSBj
YW4gcmVhZCB0aGlzIGVtYWlsIGl0IGlzIHByb2JhYmx5IGNvbmZpZ3VyZWQgY29ycmVjdGx5Lg0K
DQo9PT0NCkdpdGh1YjogaHR0cHM6Ly9naXRodWIuY29tL2RhbmktZ2FyY2lhL3ZhdWx0d2FyZGVu
--iLePJ00w6AbvX6b3LZWjcAAT5z9FJz90mSdS2sWi
--iLePJ00w6AbvX6b3LZWjcAAT5z9FJz90mSdS2sWi--
.
250 2.0.0 OK  1634565010 v5sm7303356qkp.0 - gsmtp
```

**Reply by ninjamonkey198206** [reply]
It came through as a mostly blank email, but it arrived.

**Reply by ninjamonkey198206** [reply]
@paolobarbolini it's possible. I'm learning as I go with this. I usually deal with physical systems and networks. This is the first time I've gone this far down the rabbit hole with mail systems.

**Reply by ninjamonkey198206** [reply]
The only thing I know for certain is that emails were working previously with the same configuration in place. I found out they weren't working anymore by trying to invite someone to an organization. Thankfully I hadn't gone too far in getting everything imported and set up, as I just finally convinced this client to get off their butts and start using a password manager at all.

**Reply by paolobarbolini** [reply]
What I'd do here honestly is get them to use a real SMTP relay service and not gmail. From a quick Google search they seem to have a lot of issues and nobody really has time to investigate them all

**Reply by ninjamonkey198206** [reply]
That's the fun part.
The relay, same exact settings, works perfectly fine from my home server.

The firewalls on the VMs are the same, etc.

The only difference is that the VM on Google's Cloud Instance now fails to send the emails, specifically from Vaultwarden only.

Other containers are running and send emails using the same relay just fine.

**Reply by ninjamonkey198206** [reply]
From the debug info, it fails to get a response after sending the . , or isn't waiting long enough to get the response before sending the quit command.

**Reply by ninjamonkey198206** [reply]
That lack of 250 ok response after the . is where it seems to fail, I just have no idea why it's happening.

**Reply by BlackDex** [reply]
have you only tried using `smtp-relay.gmail.com` or also `smtp.gmail.com`?
I think you should mostly use `smtp.gmail.com` where you can.
It also shouldn't matter if you use FullSSL or StartTLS, but please try both of course.
Also, see what happens if you enforce a specific Authentication Mechanism. Default is `Plain`, try to set it to `Login`
So, set `SMTP_AUTH_MECHANISM="Login"` or try `SMTP_AUTH_MECHANISM="Plain"` to force one of them, gmail supports both when using an encrypted conenction.

Ow, and indeed, set a nice `HELO_NAME` also, i read that `localhost` for example could cause issues with gmail.
So, if you have a valid hostname for your Vaultwarden server, just enter that `HELO_NAME=vaultwarden.domain.tld` for example.

**Reply by ninjamonkey198206** [reply]
@BlackDex Yep. Tested the relay on my home server and it gets the 250 ok response after the .
That seems to be the only real difference. The Google hosted VM stops getting responses after sending the . It stalls for a few seconds, then sends the QUIT command without first receiving the 250 ok in response to the .

I did try all of the combinations you mentioned as well.

I'm at a loss as to why it's not getting that response after the . when it receives the appropriate response at every other step.

**Reply by paolobarbolini** [reply]
Does it also happen if you make a brand new VM? I'd test it myself but I don't have an account with GCP 😅

**Reply by ninjamonkey198206** [reply]
I've even tried completely scrubbing the container from the VM; images, network, volumes, etc, then a reboot of the VM just to make sure anything that might be hanging around in memory got scrubbed.

Same thing every time.

**Reply by ninjamonkey198206** [reply]
@paolobarbolini I haven't tried that yet. Mostly because if I have to migrate everything over to a new VM it's going to suck since there are still many services I haven't ported over to docker yet.

**Reply by ninjamonkey198206** [reply]
@BlackDex @paolobarbolini 
To recap:

When using starttls on port 587, or TLS on port 465, on both smtp and smtp-relay, it goes through the entire process, logs in, sends the data for the message, and gets no response after sending the . to close out the email. That's when using both plain and login authentication methods, trying single name and full email address in the from name field, and when using hostname, fqdn, and just the domain in the HELO field.

When using TLS and 587 the cert error mention at the very beginning of this discussion occurs.

When using starttls and 465 it simply refuses to connect at all without even checking the cert.

The entire process completes without issue from openssl from inside the container.

The fact that it gets to the point of sending the . for termination eliminates network, firewall, and port issues, or it would fail before that. 
(I believe)

The only thing left in terms of troubleshooting environment is to spin up another GC instance without all of the other services already in place for a "clean testbed" to see if it works. If it does, then we begin adding the other services until it fails again to determine what's going wrong. If it fails immediately on a clean vm, then we know it's something to do with the mailing process and being on a GC instance, at which point we just say screw it and you put a warning in the documentation to stay away from CGP until someone trips over the solution.

Did I miss anything?

**Reply by amousset** [reply]
> 
> When using TLS and 587 the cert error mention at the very beginning of this discussion occurs.

On port 587 you shouldn't use TLS directly but only STARTTLS, so this is expected.

> 
> When using starttls and 465 it simply refuses to connect at all without even checking the cert.

Normal too, it tries to talk as cleartext while the server expects TLS.

> When using starttls on port 587, or TLS on port 465, on both smtp and smtp-relay, it goes through the entire process, logs in, sends the > data for the message, and gets no response after sending the . to close out the email. That's when using both plain and login 
> authentication methods, trying single name and full email address in the from name field, and when using hostname, fqdn, and just the 
> domain in the HELO field.
> [...]
> The fact that it gets to the point of sending the . for termination eliminates network, firewall, and port issues, or it would fail before that. (I believe)

Yes, this indeed looks like a bug in lettre, or at least in the interaction between lettre and and gmail servers in some cases. The `WouldBlock` error could actually indicate a write timeout.

**Reply by BlackDex** [reply]
@amousset would increasing the timeout be something to test then? Currently the default is set to 15 seconds in Vaultwarden.
@ninjamonkey198206 could you try to increase the timeout? You need to change the `SMTP_TIMEOUT` environment variable for this. You could try to set it to `60` or something, that would seem to be more then enough.

**Reply by ninjamonkey198206** [reply]
@BlackDex @amousset no joy. Tried setting it to 60 and then 120. Same result.

**Reply by ninjamonkey198206** [reply]
Well this is interesting. I've got it working over here currently. Either something changed on Google's end, or I found out something interesting.

Apparently something changes in the last communication stages when it sends the . and quit, as both essentially time out.

I've mentioned before that I have a drop by default IPTables firewall on the VM itself, and bind the exposed ports to localhost, using HAProxy to direct traffic appropriately. Using drop by default breaks accessing the docker containers via localhost regardless of where you bind the docker ports, but adding rules to allow traffic to the docker network solves that without exposing the listening ports to the world.

That has never stopped any normal necessary communication with the outside world for any container on any of my systems before (DNS, email, etc) but even with a blanket accept all rule to the docker bridge the closing part of the email was failing.

On a whim I added new rules explicitly allowing all related traffic to the docker bridge network, and it worked. I've never needed to do that before, as I already have rules accepting established and related traffic, and have no idea why it allowed all other traffic but the last two steps during the email process, nor why it worked until recently if that was an issue.

**Reply by ninjamonkey198206** [reply]
It shouldn't make any difference at all, as everything else worked, it had worked previously, and other containers with the same firewall rules in place worked perfectly fine sending emails via the same server/relay, and yet...

¯\\\_( ' _ ' )\_/¯

**Reply by paolobarbolini** [reply]
> Regarding the `-crlf`, if i'm correct, but @paolobarbolini should correct me if i'm wrong, that is exactly what lettre is sending. So, with `-crlf` is the correct way, and should represent the same as is done with lettre.

Correct

**Comment by paolobarbolini** [comment]
Hello, pretty late here but I'll try giving you something to try. I think we can rule out the wrong port ipothesis as failing to connect would have never gotten lettre to the point of sending commands to the SMTP server (https://github.com/dani-garcia/vaultwarden/discussions/2040#discussioncomment-1487078) 

What you could try as a quick test is to use openssl to open a TLS connection to the relay server and manually issue SMTP commands. From a quick glance on Google most SMTP guides seem incomplete, for example most of them don't tell you to login. You can follow those but also check against commands issued by lettre (which you can see in the logs) to see if they missed a step.

I'll try looking deeper into this and sending more specific instructions in the following days.

**Comment by dl-lim** [comment]
Hi all, just to reiterate on my opening thread, I'm not using Google or any of their strange "less secure apps" protocols. I'm selfhosting mailcow (https://github.com/mailcow/mailcow-dockerized), and this has been running well for my system for a long time. SSL/TLS works on incoming and outgoing emails.

Is there currently a way to bypass this invitation process so that I can get a new user set up?

**Reply by BlackDex** [reply]
Well in your output it says that the cert has expired. Did you try out the `testing` image?

Have you checked the validity of the certificate?

**Reply by ninjamonkey198206** [reply]
Tangentially related question: have you updated the mailcow container recently?

**Reply by BlackDex** [reply]
Regarding the image, it probably is better to use the current `latest` image now which has just been released

**Reply by dl-lim** [reply]
Thank you - can confirm that using `:latest` image fixed it. I usually put the exact image tag for documentation purposes.

**Reply by BlackDex** [reply]
Great, then i think you were using a LetsEncrypt cert which needed some OpenSSL updates or since ca-certificate updates from the base image

**Reply by Blackclaws** [reply]
The issue still persists with the 1.24.0 and latest images. Testing works. When can we expect an official release with the updated certificates? Anyone using current letsencrypt certificates is affected by this I think.

**Reply by BlackDex** [reply]
`v1.24.0` and `latest` are identical so that is not strange.
`testing` is based upon the `main` branch and build every time there is a new commit/merge.

We are still working on some optimizations and there has been a new release of some libraries which we probably want to update to.
Which needs some testing.

**Reply by Blackclaws** [reply]
Gotcha. Might I suggest an updated v1.24.0 image then that just rebuilds with the latest base image? That should solve the issue.

**Reply by BlackDex** [reply]
Not sure if that would solve the issue, since those images are based upon an older version of debian, and i'm not sure if that has the correct updates to solve your issue.
